id,title,link,date,text
https://yle.fi/uutiset/11857799,Finland's looming lockdown: What will — and won't — be allowed?,https://yle.fi/uutiset/osasto/news/finlands_looming_lockdown_what_will__and_wont__be_allowed/11857799?origin=rss,"Fri, 26 Mar 2021 14:21:00 +0200","People in Finland are wondering what is in store if the Finnish government's proposed societal lockdown for areas where the coronavirus epidemic is raging fiercest (effectively the Helsinki region and Turku at present) is approved by Parliament.
The government has issued a list of regulations in its legislative draft, but in an effort to make them more user-friendly, Yle has interpreted the rules in a question-and-answer format.
As the proposed restrictions have not yet been approved by MPs, they could still change. When, exactly, the rules would go into effect — as well as their planned duration — also remains unknown.
Outdoor activities and leisure
Who can you meet indoors and at home?
In general, people living in the locked-down regions will only be permitted to meet members of their own household in indoor situations. However, those in ""established relationships"" who do not live in the same household will be able to meet. Another exception includes caring for a person with disabilities or the elderly.
Can I have a party?
Kind of. As written, the rules say that only people from your household would actually be permitted to attend. In other words, the only ones who could join in the party are those who live in the same home.
Can I travel to a rented cottage in Lapland or somewhere else in Finland?
People can only travel to cottages or leisure homes if they, or someone from the same household, own them or have already rented them for an extended period.
Renting a cottage for a week does not qualify for the exception. Only people from the same household are allowed to visit the cottage or leisure home.
With whom can I meet outdoors, and where?
As mentioned, people from the same household can meet outdoors together. It will also be permitted to meet with up to two others from another household, meaning that three people can meet outside while maintaining a two metre distance from each other.
Story continues after photo.
File photo of people jogging outdoors.Henrietta Hassinen / Yle
Is it OK to take a taxi to the station and take a train to another area?
People will not be allowed to travel beyond the regions affected by the heightened restrictions, except to go to leisure homes (see entry on cottage visit rules).
Additionally, for example, people from affected areas will not be permitted to stay at hotels.
All Finnish citizens are permitted to leave and enter the country during the lockdown period. Meanwhile, foreign visitors may only enter the country for essential reasons, but will be able to leave the country.
The Finnish Border Guard has published an extensive guide about the rules for citizens of various countries.
Can I pick up friends in my car if we're going for a walk?
Unless safe distances can be maintained during such a scenario, such situations should be avoided. Keep in mind that people are not allowed to leave regions affected by the lockdown orders.
Can I go to places of worship?
In the traditional sense, no. People in affected areas will not be permitted to gather for religious gatherings. Going to a place of worship will only be allowed on an individual basis, such as to meet with a clergy member on your own.
Shopping and errands
Can I go to the grocery store?
Yes. As foods are considered essential items, it is permitted.
Can I go to alcohol retailer Alko?
As alcoholic drinks are deemed to be foods, yes you can.
Story continues after photo.
Person holding a shopping basket, file photo.Tiina Jutila / Yle
Can I buy cigarettes at the kiosk, make-up in shops or plants at the garden centre?
These items are not considered foods nor essential items, so no. But one will be able to buy such items if they're available in grocery stores.
Can I go to the hairdresser or beauty salon?
As haircuts, manicures and similar services are not considered necessities, the answer is no.
What about takeaway food?
You can pick up restaurant food but it must be ordered in advance. Home delivery of meals is also an option, as food couriers are carrying out their jobs, so it is allowed.
What happens if a home appliance breaks, can I go get parts or a replacement?
Visits to hardware stores are OK if an essential appliance has broken or needs a replacement part, if the matter cannot be taken care of later.
Children and relatives
People 13 years of age or older (born in 2008 or later) are allowed to play outdoors with other kids. Children are also permitted to move about outside to take part in hobbies. A guardian, older sibling or other relevant person is allowed to monitor the child or children, taking into account safe distancing measures.
Can kids from divorced families travel to other regions or homes to meet their parents?
Children will be allowed to travel between their parents' homes as arranged, for example every two weeks. An adult who lives with the child (or children) may escort them to another home or residence without breaching the temporary restrictions.
Who is considered a close relative? Who's allowed to care for others and what about funerals?
It will be permitted to help and support children, even if the person helping isn't a blood relative. Grandparents may also take care of their grandkids.
If a close relative becomes ill, you can help them.
Additionally, it will be permitted to arrange and attend funerals.
Property and vehicle maintenance
Will it be OK to maintain properties, a building or vehicle?
Yes. It will be possible to visit a property or building in another location. Buildings, vehicles and the like may be serviced or repaired, according to the draft version of the rules.
Is moving house permitted during the lockdown?
Moving from one residence to the same or another region is permitted. It remained unclear on 26 March whether friends or relatives would be allowed to help people move. However, hiring workers from a moving company will be permitted."
https://yle.fi/uutiset/11858453,Jail terms for two in Finland's first dark web contract killing,https://yle.fi/uutiset/osasto/news/jail_terms_for_two_in_finlands_first_dark_web_contract_killing/11858453?origin=rss,"Fri, 26 Mar 2021 16:16:35 +0200","A Finnish court on Friday handed a life sentence each to two men for the contract killing of one of the men's father, via an arrangement made on the dark web.
Previously, Pirkanmaa District Court found Aatu Viljami Halonen, 20, guilty of soliciting murder and Mika Markus Aleksi Hytönen ,19, guilty of carrying out the act.
The case marked Finland's first murder-for-hire trial that was arranged online and the fourth hired killing conviction in the country in two decades.
In January 2020, Tampere police found the body of a 44-year-old man in his home, after his neighbors reported an assault taking place outside between the killer and the victim.
After arresting the suspect, police uncovered evidence the case was in fact a contract killing, ordered by the victim's son.
Hytönen confessed to having killed the victim but claimed that he only intended to rob him. The court heard that he told his fiancé he had fantasised about taking another person’s life for some time.
Dark web advert
In 2019, Hytönen posted an ad on the Tor internet network—which facilitates anonymous and encrypted online communication—offering his services as a hit man, asking to be paid in Bitcoin.
Hytönen turned Halonen into police. According to the prosecution, the motive for the hit was possibly financial, but its roots lay in the victim's treatment of the defendant as a child.
The fee for the killing, said to be 10,000 euros, was to be paid from the inheritance left behind by the victim. Through his lawyer Tomi Borgenström, Halonen continues to deny his part in his father's homicide, claiming to have been framed.
The sentencing took place nine months after Pirkanmaa District Court found then-19-year-old Hytönen guilty of murder, and 20-year-old Halonen guilty of soliciting murder. Both were ordered to undergo psychological evaluations at the time. The results were presented in court Friday morning, and both defendants were found fit to stand trial.
The verdict and sentences can still be appealed."
https://yle.fi/uutiset/11859167,Lockdown law stuck in parliament till after Easter,https://yle.fi/uutiset/osasto/news/lockdown_law_stuck_in_parliament_till_after_easter/11859167?origin=rss,"Fri, 26 Mar 2021 18:56:17 +0200","A package of lockdown measures proposed by the government this week will not be approved before Easter, as parliamentary time ran out on efforts to pass the bill.
In the debate on Friday, Prime Minister Sanna Marin (SDP) told MPs that the proposed laws were unavoidable.
""In the regions with the worst epidemic situation, we need a sufficiently comprehensive restriction that would significantly reduce contacts between people,"" said Marin.
Even so, the laws will not be approved before the four-day Easter holiday.
MPs are not sitting in Easter week, so parliament is unable to vote on the bill before the holiday. The next possible date to decide the matter in parliament would be Tuesday 6 April.
Parliamentary committees, however, will continue to handle the bill throughout the week.
On Thursday the government submitted a proposal to parliament with which it can propose a temporary restriction on freedom of movement, as well as implement mandatory use of masks in areas worst hit by the corona epidemic.
Secretary General of Parliament, Maija-Leena Paavola, told Yle earlier that the proceedings would take too long for the laws to be taken into effect before Easter.
Interior minister Maria Ohisalo (Green) echoed her sentiments on Thursday night’s A-Studio, saying that there would be a rush to implement the laws before Easter.
The laws would severely restrict movement in areas worst-hit by the pandemic, with the measures expected to be in force in the Helsinki area and in Turku initially.
In Friday's debate PM Marin was also asked whether Finland had decided to focus incoming vaccine doses on the areas worst-hit by the pandemic, rather than vaccinating the whole country at an even pace.
She said that this was an option, and could be considered after the elderly, frontline healthcare workers and others at-risk from Covid had been vaccinated throughout the country, but that no proposal was on the table yet."
https://yle.fi/uutiset/11859063,Justice Minister Anna-Maja Henriksson survives no confidence vote,https://yle.fi/uutiset/osasto/news/justice_minister_anna-maja_henriksson_survives_no_confidence_vote/11859063?origin=rss,"Fri, 26 Mar 2021 18:01:10 +0200","Justice Minister Anna-Maja Henriksson (SPP) survived a confidence vote in parliament by 103 votes to 66.
The Finns Party had filed the no-confidence motion against Justice Minister Anna-Maja Henriksson, claiming she had misled citizens and instructed municipalities to break the law in the lead-up to the decision to postpone this spring's municipal elections.
Parliament also voted to approve the postponement of the municipal elections from 18 April until 13 June.
""The claims made by the Finns party, that I had misled Parliament, are unfounded. The Ministry of Justice and I are unable to change the situation caused by the pandemic,"" said Henriksson in her speech.
Henriksson recalled that eight of the nine parliamentary parties and the Parliamentary Constitution Committee approved the postponement of the municipal elections.
""It would have been possible to hold municipal elections in April, but not responsibly,"" Henriksson added.
In addition to the Finns Party, only the National Coalition Party and Ano Turtiainen, a lone MP expelled from the Finns Party, supported the no-confidence motion."
https://yle.fi/uutiset/11858573,Psychosocial support for Sami proposed ahead of reconciliation commission,https://yle.fi/uutiset/osasto/news/psychosocial_support_for_sami_proposed_ahead_of_reconciliation_commission/11858573?origin=rss,"Fri, 26 Mar 2021 17:17:12 +0200","A working group led by the Lapland Hospital District has published its recommendations on providing psychosocial support to Finland's Sámi people during the upcoming Truth and Reconciliation Commission (TRC).
The commission is a body mandated by the Finnish parliament, the Sami parliament and the Skolt Sami council to investigate injustices committed against Finland's Sami people.
The proposed service would offer support in three Sámi languages, tailored to individual cultures. The service would be available to all Sámi living throughout Finland.
""The problem now is that there are very few, if any, Sámi-language psychosocial support services in Finland. According to our study, these services are barely available in the Inari and Skolt Sámi languages,"" said Lapland Hospital District's Johanna Erholtz.
""We will probably have to buy in providers of more demanding services and rehabilitation, as well as interpretation,"" she added.
The commission, expected to take years, is intended to address the injustices experienced by the Sámi, to find out what happened to them and how it has affected them.
Psychosocial support was one of the conditions of the TRC's founding, as it will deal with traumatic experiences and sensitive issues experienced by the Sámi.
There are around 400 native speakers of Inari Sami, and around 300 native speakers of Skolt Sami.
More emphasis on collective support needed
Executive Director of the Sámi Social and Health Association Ristenrauna Magga contributed to the working group's final meetings.
She said that although the group's report did suggest providing collective support through third parties, it could have gone further.
""The proposal is based on the point of view and needs of the individual. I kept trying to point out that the need for collective support should be added to the proposal, because we Sámi have experienced difficult things as a people,"" Magga said.
The working group's report was submitted to the Prime Minister's Office and the Sámi Parliament in March."
https://yle.fi/uutiset/11860601,Consumer confidence in Finnish economy dips during March,https://yle.fi/uutiset/osasto/news/consumer_confidence_in_finnish_economy_dips_during_march/11860601?origin=rss,"Mon, 29 Mar 2021 11:17:29 +0300","The average person's assessment of the Finnish economy worsened slightly in March, according to survey data from Statistics Finland.
The consumer confidence indicator (CCI) for March stood at -3.0, down from -0.9 and -0.8 in January and February respectively.
Expectations of where the national economy would be in 12 months ""weakened clearly"", Statistics Finland said, with people's view of the unemployment situation also growing gloomier.
The CCI for March last year was -7.1. The long-term average for the economic indicator is -1.8.
However, respondents to the survey rated their own financial situation as the best-ever, with the highest measurement recorded since records began in 1995.
Consumers regarded March as a good time for saving, but poor for taking out a loan or buying durable goods, Statistics Finland said. Despite this, many survey respondents still indicated plans to borrow money within the next year, with plans to buy or renovate a home a common factor.
According to Statistics Finland, consumer confidence in the economy was strongest in the Helsinki capital region (CCI 1.2) and weakest in northern Finland (-8.3). Demographically, students were most optimistic (7.4), while unemployed people had the most pessimistic view of the nation's economic outlook (-12.9)."
https://yle.fi/uutiset/11860490,"Vallila killing suspect older than police believed, Iltalehti reports",https://yle.fi/uutiset/osasto/news/vallila_killing_suspect_older_than_police_believed_iltalehti_reports/11860490?origin=rss,"Mon, 29 Mar 2021 10:14:49 +0300","A boy who avoided criminal charges relating to a fatal stabbing in Helsinki last year was in fact old enough to be held criminally liable at the time, a report in Iltalehti has claimed (link in Finnish).
Police suspected three teenage boys of involvement in the killing of an 18-year-old man in Helsinki's Vallila district in October last year.
Two boys aged 16 at the time of the killing were sentenced to jail in February. The third boy, believed to be 14, was transferred into the care of social services as he was deemed to be too young to stand trial.
Individuals under 15 years of age are below the age of criminal liability according to Finnish law.
Forensic testing
According to Iltalehti, police re-arrested the third boy on Friday, after an unconnected report of disturbing behaviour.
Officers referred the boy for a forensic age assessment after doubts arose over his age.
Forensic age assessments determine a subject's age from a variety of sources including their teeth and the bones of the hand and wrist.
According to Iltalehti, the assessment found the boy was at least 16 years old.
Despite the new evidence, Helsinki District Court rejected a police request to remand the boy in custody.
Jukka Larkio, lead investigator in the Vallila stabbing case, refused to confirm Iltalehti's version of events, nor how police intend to proceed in the case."
https://yle.fi/uutiset/11860466,"Left Alliance, Green Party offices vandalised in Pori",https://yle.fi/uutiset/osasto/news/left_alliance_green_party_offices_vandalised_in_pori/11860466?origin=rss,"Mon, 29 Mar 2021 10:05:09 +0300","The windows of both the Left Alliance and the Green Party district offices were vandalised over the weekend in the west coast city of Pori.
The Left Alliance office appears to have been targeted first. Both offices are located along Eteläpuisto in the centre of the city.
""It seems that the vandal's colours ran out by the time they got to our office,"" the Green Party's District Executive Director Juuli Ojansuu told Yle.
Story continues after the photo.
The Green Party office in Pori was also targeted.Satakunnan vihreät
The windows of the Left Alliance office in the city were also vandalised last November.
""It is not possible to know for sure, but the language and the typos suggest that the same perpetrator could be involved again,"" said Raisa Ranta, executive director of the Left Alliance's Pori district.
Same parties targeted in Oulu
The Left Alliance told Yle that a criminal report has already been filed with police, while the Green Party's Ojansuu said the party plans to file a report on Monday.
""This is a worrying phenomenon. The intention is to intimidate,"" Ojansuu said.
The same parties were targeted by similar acts of vandalism in the city of Oulu in January."
https://yle.fi/uutiset/11860431,"Monday's papers: New vaccine plan, dodgy builders, Huuhkajat draw",https://yle.fi/uutiset/osasto/news/mondays_papers_new_vaccine_plan_dodgy_builders_huuhkajat_draw/11860431?origin=rss,"Mon, 29 Mar 2021 09:13:51 +0300","National tabloid Ilta-Sanomat claims that officials at the Ministry of Social Affairs and Health are drawing up plans that could prioritise the distribution of vaccines to the areas worst affected by the virus.
The unconfirmed report suggests that the proposal would also need the approval of the Equality Ombudsman, as any regional targeting of vaccinations in the worst-hit areas – mostly in and around the Helsinki capital region – would mean slowing the pace elsewhere.
The report comes after Prime Minister Sanna Marin (SDP) told Yle Radio Suomi on Sunday that the governing parties were ready to prioritise areas with the highest infection rates.
According to Ilta-Sanomat's sources, the Green party and Swedish People's Party pushed hard for the change. Both parties enjoy higher levels of support in parts of the south and southwest which are currently under tightened coronavirus restrictions.
Survey reveals construction industry issues
Have you bought a new home that wasn't up to scratch?
If so then you might not be alone. Helsingin Sanomat reports on a survey on the quality of new-build homes in Finland.
Respondents shared their horror stories with the paper: one mentioned how a hole in a wall had been patched up with a paper bag, while another claimed a construction worker had deliberately urinated on a bathroom wall before tiling it.
The survey, carried out by HS, elicited 196 responses, most of which concerned properties built in the capital region since 2010.
HS says the issue could be structural – workers chasing unrealistic deadlines, managers based away from the building site, and projects that can be subcontracted out numerous times.
Huuhkajat draw in Ukraine
Iltalehti is among the papers covering last night's World Cup qualifier Finland and Ukraine in Kiev, which ended in a 1-1 draw.
The match started off on a bad note for the visiting Finns, after defender Albin Granlund was struck in the face by the ball and was substituted for Nikolai Alho after just 17 minutes.
""It got him hard on the head. His head started hurting, his vision was blurry,"" Finland manager Markku Kanerva told Iltalehti after the match.
Ukraine scored the first goal of the night 80 minutes in, but talismanic striker Teemu Pukki was able to equalise from the penalty spot nine minutes later after being brought down by Ukraine defender Vitaliy Mykolenko inside the area.
The Huuhkajat, or Eagle Owls, are currently second in the qualifying group with two games played."
https://yle.fi/uutiset/11860038,Parliament extends restaurant closures until 18 April,https://yle.fi/uutiset/osasto/news/parliament_extends_restaurant_closures_until_18_april/11860038?origin=rss,"Sun, 28 Mar 2021 16:10:17 +0300","Parliament has decided to extend restaurant closures until 18 April. MPs convened for a rare Sunday session to debate the government's proposed extension of restaurant closures, among other issues.
The current restrictions, which only allow take-away sales, expired on Sunday so a speedy decision was needed to extend them for another three-week period without a break.
The president was due to sign the law later on Sunday.
Regions remain uncertain
Later on Sunday, the government is to issue a separate decree on which areas will be affected by the closure of restaurants.
According to preliminary information received by the STT news agency, the restaurant restriction situation is to remain unchanged in most parts of the country. The exception would be Southern Ostrobothnia, where restaurants could be opened as the pandemic situation has improved to baseline.
Changes may also be coming to Northern Savo, where restaurants may have to close due to the deteriorating situation.
Up until now the closure has covered nearly the whole country, i.e., the areas that are in the so-called acceleration and community transmission phases of the pandemic.
The only areas that are in the lowest baseline phase and thus apparently not affected are South and Central Ostrobothnia, North Savo, North Karelia and Kainuu.
Opposition seeks open terraces in Lapland, takeaway alcohol sales
Opposition MPs criticised the bill for including all restaurants, bars and cafés in the same category, ranging from lunch-only restaurants to karaoke bars and nightclubs.
The opposition also called for a reduction in VAT on restaurants and a more regional targeting of closures, as well as more subsidies for the sector.
In addition, the Finns Party and the National Coalition Party want to allow restaurants to sell alcoholic beverages to take-away customers as a way to help restaurateurs make up for some of their financial losses. At present state-owned Alko shops have a monopoly on retail sales of drinks with alcohol content of over 5.5 percent.
Opposition lawmakers also questioned the complete closure of restaurants in Finnish Lapland, arguing that they should be allowed to serve on outdoor terraces while observing social distancing and other safety measures.
Regional authorities may close gyms, other recreational facilities
Also on Sunday, Parliament approved a temporary amendment to the Communicable Diseases Act, giving regional authorities the power to temporarily close gyms and other recreational facilities in the areas worst-hit by the epidemic.
The amendment clarifies Article 58g of the Communicable Diseases Act, which recently caused differences of interpretation between the Ministry of Social Affairs and Health and regional government agencies.
17:00 Added information about gyms and other recreational facilities."
