id,title,link,date,text
https://yle.fi/uutiset/11842957,SAK poll: A quarter of employers limit workers' freedom of speech,https://yle.fi/uutiset/osasto/news/sak_poll_a_quarter_of_employers_limit_workers_freedom_of_speech/11842957?origin=rss,"Thu, 18 Mar 2021 11:05:16 +0200","According to the Central Organisation of Finnish Trade Unions SAK, one in four employers has unjustifiably restricted the right of employees and shop stewards to express their views on matters concerning the workplace.
According to a SAK survey of union shop stewards, the most common ways to restrict employees' freedom of speech are banning comments on workplace-related issues on social media or in media interviews. Nearly a quarter, 23 percent, of respondents to the survey reported employer policies that they considered unjustified restrictions on their freedom of speech.
Other restrictions imposed by employers were found to be bans on written pieces of commentary and opinion, and demands to review any interviews given to the media before publication. There are also reported cases of journalists being denied access to some workplaces.
Paula Ilveskivi, a lawyer at SAK, points out that employees have a constitutional right to express their opinions in public. It can, however, be limited in certain matters by requirements for professional confidentiality and loyalty requirements by the employer.
Of the shop stewards who responded to the survey, more than a quarter, 27 percent, said opinions publicly expressed by an employee at their workplace had led to action by the employer, usually a meeting with, or warning from the employer. In a few cases, the worker had been dismissed.
""In these situations, it would be considerably [more] helpful to jointly agree on clear guidelines and rules for each workplace on communicating workplace-related issues or opinions,"" Ilveskivi stated in a SAK press release.
The survey was conducted in late February and early March, receiving 825 responses from union shop stewards and occupational safety and health representatives."
https://yle.fi/uutiset/11843330,Nato report: Finnish female cabinet members targeted by social media hate campaign,https://yle.fi/uutiset/osasto/news/nato_report_finnish_female_cabinet_members_targeted_by_social_media_hate_campaign/11843330?origin=rss,"Thu, 18 Mar 2021 12:47:21 +0200","The Finnish coalition government, where all five governing parties are headed by women, is the subject of a constant campaign of hate speech on social media, according to a new report by the NATO Strategic Communications (Stratcom) Centre of Excellence based in Latvia.
Entailed ""Abuse of power: Coordinated online harassment of Finnish government ministers"" (external link here), the report states that the five ministers most affected are women and are the target of a massive, hostile attack that calls into question their values, decision-making and leadership qualities.
It found that the main topics triggering abusive messages were the Covid-19 pandemic, immigration, Finnish-EU relations, and socially-liberal politics. Most of the harassment came in messages posted by real individuals, not computer-programmed bots, and most were anonymous.
The Stratcom report drew on the findings of three recent Finnish studies, one of which investigated the extent and effects of online hate speech against politicians, while the other two studied the use of bots to influence political discourse during the 2019 Finnish parliamentary elections.
The first study, released by the Finnish government in November 2019 found that a third of municipal decision-makers and nearly half of all members of the Finnish Parliament have been subjected to hate speech online.
The Nato report sees a constant flow of hate speech and hostile feedback as threats to Finnish democracy. It notes that the Finnish government's 2019 study found that 28 percent of decision-makers who have been the subject of hate speech feel that their willingness to participate in the political decision-making process has decreased.
The Stratcom study focused on social media messaging via Twitter."
https://yle.fi/uutiset/11843362,FM expert: Russia testing EU with false Sputnik information,https://yle.fi/uutiset/osasto/news/fm_expert_russia_testing_eu_with_false_sputnik_information/11843362?origin=rss,"Thu, 18 Mar 2021 13:05:20 +0200","Russian authorities are spreading false information about the production of the Sputnik V vaccine in EU countries, according to specialists from both the Finnish Foreign Ministry and the Prime Minister's Office.
The foreign ministry’s Ambassador for Health and Wellbeing, Päivi Sillanaukee,told Yle Radio 1's Ykkösaamu that information provided by Russia about the production of the Sputnik vaccine in Germany, Italy and France is untrue.
Several media outlets reported this week that Russia's RDIF sovereign wealth fund confirmed it had reached ""agreements with companies from Italy, Spain, France, and Germany to launch production"" of the Sputnik vaccine.
""The people in charge there have pointed out that no such agreements have yet been concluded, and in any case it would require the approval of the European Medicines Agency (EMA) and a wide range of other approvals from the pharmaceutical authorities in each country,"" Sillanaukee said, adding that Russia is testing the reaction of other countries with the announcement of the agreements.
She further stated that the start of production would in any case be slow, and would be unlikely to begin until the end of the year if agreements were indeed reached with states or companies.
Sillanaukee, who is also a member of the Executive Board of the World Health Organization (WHO), said that the development of the Sputnik vaccine is a scientific win for Russia.
Economic, political motives 
Russia has both economic and political motives in announcing the agreements, according to Jussi Toivanen, Chief Communications Specialist at the Prime Minister's Office.
Russia, he said, may want to disrupt EU unity by spreading false information.
""It can also have a purely economic motive: with the aim of getting trade,"" he added.
Hungary has already started using the Sputnik vaccine while the Czech Republic and Slovakia have ordered doses and indicated that they will begin rolling it out even without EMA approval. Russia is currently applying for a Europe-wide marketing authorisation for Sputnik from the EMA.
The application process begins with preliminary research that Sillanaukee said is now underway. No formal permit application has, however, as yet been submitted."
https://yle.fi/uutiset/11843748,Supo identifies China-linked cyber-spying agent in Finnish Parliament hack,https://yle.fi/uutiset/osasto/news/supo_identifies_china-linked_cyber-spying_agent_in_finnish_parliament_hack/11843748?origin=rss,"Thu, 18 Mar 2021 15:44:44 +0200","The Finnish Security and Intelligence Service (Supo) has identified a cyber espionage operation as being behind a cyber-attack on Finland’s Parliament last autumn. Some data security firms have linked the operation to the Chinese state.
In a press release on Thursday, the agency said that 2020 was a year of ""exceptionally intensive cyber espionage operations both in Finland and elsewhere in Europe"", which included the attempt to infiltrate Parliament’s IT systems.
The National Bureau of Investigation (NBI) said at the time that the attack was detected by the legislature’s internal technical surveillance and the security of a number of parliamentary email accounts was compromised, some of which belonged to MPs.
The NBI announced via a press release on Thursday that the matter is being investigated as a suspected aggravated computer break-in, aggravated espionage, and aggravated message interception.
In its own statement, Supo said that the state cyber espionage operation APT31 was responsible for the attack.
APT31 has previously been linked to China’s state cyber operations, for example by security companies such as Checkpoint (external link) and FireEye (external link).
The NBI added that some indications of possible perpetrators were discovered during the analysis of material collected during the criminal investigation.
""We are investigating links to the APT31 group, but we will not disclose any details about the facts discovered as the criminal investigation is ongoing,"" Detective Superintendent Tero Muurman of the NBI said. ""The motive is under investigation. We have not excluded the possibility that the purpose of the attack was to gather intelligence to benefit a foreign state or to harm Finland's interests.""
Speaker of Parliament Anu Vehviläinen (Cen) said on Thursday that she considered it important that such a serious attack on Parliament had been traced.
""When the suspected crimes in an investigation are aggravated espionage, aggravated burglary, and aggravated breach of confidentiality, everyone understands how serious the matter is. Such activities are always an attack on our democracy and on Finnish society,"" Vehviläinen said.
Breach triggered extensive investigation
When a possible data breach was first suspected, Supo provided information to Parliament, on the basis of which the Parliament's IT administration could identify possible further hacking attempts.
Parliament acted in accordance with the instructions it received and further strengthened its information security, Supo said.
Supo also provided information to the National Cyber Security Centre Finland (NCSC-FI) so that it could improve its own monitoring capabilities.
When Parliament's own technical report revealed that the IT systems had been breached, Supo assessed that the constituent elements of an aggravated offence were met and reported the case to the NBI."
https://yle.fi/uutiset/11844076,"Government to cover bar, restaurant wages for three-week closure",https://yle.fi/uutiset/osasto/news/government_to_cover_bar_restaurant_wages_for_three-week_closure/11844076?origin=rss,"Thu, 18 Mar 2021 16:31:00 +0200","The government is planning to fully subsidise wages for bar and restaurant workers affected by the three-week compulsory closure order.
In addition, businesses will be compensated for up to 70 percent of their rental costs as well as other similar business-related expenses.
In addition to bars and restaurants, reimbursements for loss of earnings due to the closure order can also be claimed by gyms, public saunas, spas and indoor playgrounds, among others.
The compensation will be based on the company’s expenses in February 2021 as well as a statement of how much of the business has been affected by the closure. Coronavirus subsidies granted in the past will be taken into account and the maximum amount of aid should not exceed 1.8 million euros under EU state aid rules.
If the business has continued to provide takeaway food during the closure period, as is permitted under the government order, this will also be taken into account when calculating the amount of compensation.
Ministry: Total compensation bill about €70m
The Ministry of Economic Affairs and Employment estimated that the total amount of compensation paid out to businesses forced to close during the three-week period will be approximately 70 million euros.
The ministry added that about two thirds of this figure will be used to support small and medium-sized businesses and one third to support bigger companies.
The closure compensation currently proposed by the government applies to companies with up to 49 employees, with further support for larger businesses in the pipeline.
""However, we wanted to get support for small businesses up and running as soon as possible, so support packages for small and large companies are being prepared separately. Support for the event industry is also currently being prepared separately,"" Minister of Economic Affairs Mika Lintilä (Cen) wrote in the ministry's press release.
The support package for bars and restaurants is due to be discussed in Parliament alongside the proposal for general support for companies, or the so-called cost support 3.
The law allowing for the compensation of bars and restaurants is projected to come into force on 12 April, with the application for reimbursements open to companies by early May. Support for the cost of the compensation will be sought from the State Treasury.
Bars, restaurants, cafes and nightclubs have been closed since Tuesday, 9 March in 15 regions which are considered to be in either the accelerating or community transmission phase of the epidemic. Take-away and delivery food may still be sold.
The closure order is due to run until 28 March."
https://yle.fi/uutiset/11843676,APN election edition: Sari Essayah,https://yle.fi/uutiset/osasto/news/apn_election_edition_sari_essayah/11843676?origin=rss,"Thu, 18 Mar 2021 18:28:27 +0200","Finland legalised gay marriage four years ago. But the Christian Democrat Party, a staunch opponent of same-sex unions, still states on its website that ""a same-sex registered relationship must not be considered equal to a marriage.""
Local councils are responsible for providing education, which is why the All Points North podcast asked Christian Democrat leader Sari Essayah if schools in her North Savo community would consider providing material reflecting LGBT families to help combat bullying and promote inclusion.
""Everyone should be respected,"" she said, but did not elaborate further.
You can listen to the full podcast using the embedded player here or via Yle Areena, Spotify, Apple Podcasts or your usual podcast player using the RSS feed.
Article continues after audio.

Essayah defended Finland's practice of separating school pupils by religion for religious education classes.
""When you know your own religious background it's easier to understand and also respect others' views,"" she said.
Essayah said she was in favour of seeing more charging stations for electric vehicles but didn't believe municipalities should be tasked with providing them.
The Christian Democrat leader also criticised the government's Covid response, noting that the ""borders have been leaking all the time.""
She also said it didn't make sense for the administration to blame sluggish Covid responses on the decentralised nature of government, ""we have this kind of structure in our administration and every government should know that.""
Join the conversation!
This week's show was presented by Egan Richardson and Zena Iovino. It wasproduced by Mark B. Odom while the audio engineer was Joonatan Kotila.
If you have a question or would like to share your thoughts, you can contact us via WhatsApp on +358 44 421 0909, on our Facebook or Twitter accounts, or at yle.news@yle.fi and allpointsnorth@yle.fi."
https://yle.fi/uutiset/11845426,"Friday's papers: Police ready for curfew, vaccination strategy, stormy weather",https://yle.fi/uutiset/osasto/news/fridays_papers_police_ready_for_curfew_vaccination_strategy_stormy_weather/11845426?origin=rss,"Fri, 19 Mar 2021 09:17:15 +0200","No decision has yet been made to impose restrictions on movement in Finland as a means to battle the current wave of coronavirus infections, but there have been multiple reports in recent weeks that the matter has been under consideration by the government.
Finland's largest circulation daily, Helsingin Sanomat reports that police officials are already prepared, however, to enforcement these measures, if they are rolled out.
National Police Commissioner Seppo Kolehmainen told the paper, however, that if restrictions are imposed, they should be so clear and simple that both the authorities and the public understand the rules.
While he expressed the hope that restrictions on movement are not brought into force, if they are, the police will do their best to carry out the task of supervising them.
Helsingin Sanomat notes that the leaders of government parties will be meeting on Friday to consider the next steps in the battle against the epidemic and will possibly be discussing restrictions on movement.
Minister of Family Affairs and Social Services Krista Kiuru (SDP) told a press conference on Thursday that restrictions on movement have not been ruled out.
The issue was further highlighted on Thursday when Turku's Mayor Minna Arve filed a formal request for official assistance from the police in supervising quarantines during what she described as the city's worst outbreak of the virus.
Police Commissioner Kolehmainen told Helsingin Sanomat that he does not want to see a situation in which the police have to interpret the rules, or one in which police have to interrogate citizens about their comings and goings.
""Likewise, fines and other sanctions should be so simple that they can be understood by the police and the public,"" he added.
Reconsidering vaccination strategy
The tabloid Ilta-Sanomat carries a review of a Thursday evening Yle television discussion in which members of the national vaccination expert group suggested a change in strategy that would shift supplies of vaccines to areas with the highest rates of coronavirus infection.
The CEO of Helsinki University Hospital, Juha Tuominen pointed out that there is wide regional variation, with infection rates in some areas ten or more times higher than in others.
As Ilta-Sanomat notes, these ""red spots"" on the map are mostly in the capital region, along main commuter routes.
Tuominen stated that the public public is entitled to equal protection, but he also interpreted this as meaning that more vaccine should be made available where it is most needed. He argued that with the right targeting, one-fifth of hospitalizations caused by the coronavirus could be avoided.
""This is important at the individual level, and this is also important at the community level,"" Tuominen pointed out.
The Swedish-language daily Hufvudstadsbladet writes that if a decision is made to refocus vaccination efforts and distribution of vaccines, the move would take three to four weeks at best to implement the new policy in practice.
Under this new new system, the vaccines would be distributed on the basis of population, number of new infections and hospitalizations in recent weeks.
Meanwhile, Jyväskylä's Keskisuomalainen carries a survey by the Uutissuomalainen news group showing that the majority of hospital districts around the country are not in favour of vaccination strategy being changed.
According to the survey, 14 of the 20 hospital districts support the current vaccination schedule, at least in broad outline. Only in the Helsinki and Uusimaa hospital district and in the Länsi-Pohja hospital district in Lapland was there clear support for change.
Farewell to Malmi Airport
Helsingin Sanomat carries a text and photo review (pay-walled) of aviation history at Helsinki's Malmi Airport, which saw its final flight last weekend.
Article continues after photo.
Helsinki's Malmi Airport was long the country's most important aviation centre.Petteri Bülow / Yle
Built in 1936, Malmi Airport over the years served both aviation enthusiasts and professionals. It was Helsinki's passenger air traffic airport until a new one was opened in the rural countryside of present-day Vantaa in 1952.
During the Second World War, Malmi Airport was used by both the Finnish Air Force and for some time also by the German Luftwaffe.
In recent years, Malmi has been Finland's second busiest airport in terms of flight volumes after Helsinki-Vantaa. This past year, the coronavirus pandemic, it again became the country's busiest when traffic at Helsinki-Vantaa slowed down.
The owner of the land, the City of Helsinki, has decided to build housing in the area. Part of the field along with its buildings are protected.
Stormy weekend
Iltalehti tells readers that while Friday temperatures remain below normal for the time of year, for the most part the day should be dry and sunny.
However the weekend will bring snowstorms and blustery winds.
High winds are forecast to start on Saturday bringing snow to central and southern regions. By Saturday night or early Sunday morning Kainuu, Koillismaa and southern Lapland can expect to see heavy snowfall that will hit southern parts of the country as both snow and sleet.
Parts of the north and east are likely to be hit by usually high gusts of wind on Sunday."
https://yle.fi/uutiset/11845734,Finland ranks as world's happiest country (again) despite corona crisis,https://yle.fi/uutiset/osasto/news/finland_ranks_as_worlds_happiest_country_again_despite_corona_crisis/11845734?origin=rss,"Fri, 19 Mar 2021 11:08:47 +0200","For the fourth year in a row Finland ranked as the happiest country in the world, according to this year's World Happiness Report.
Unlike in previous years, the happiness index included surveys on how countries have dealt with the coronavirus pandemic that has shaken the world for more than a year.
The report's authors said this year's survey examined the effects of the crisis on the structure and quality of people's lives as well as looked at how governments dealt with it.
Trailing behind Finland on the happiness index were Iceland, Denmark, Switzerland, and the Netherlands.
All of the Nordic countries were ranked within the list's top 10, while Estonia was 28th and Russia 60th most happy out of the index's total of 149 nations.
The southern African country of Zimbabwe was listed at the bottom of the happiness rankings. Meanwhile the 20 countries found at the bottom of the list were located in Africa, many of which were dealing with difficult situations, unrest or even civil war.
The annual, independent survey is organised by the United Nations Sustainable Development Solutions Network. Rankings were reached via several surveys but chiefly used data from the Gallup World Poll.
About 1,000 respondents in each country were asked to, for example, rate the quality of their lives on a scale of zero to 10.
Other questions included how many times respondents laughed or felt joy and satisfaction the previous day. Conversely, the survey also took into account negative emotions such as asking how often respondents had felt worry, sadness or anger the previous day.
Corona crisis effect
The happiness report is in its ninth year of publication, but this year it also looked at how countries and their inhabitants had dealt with the coronavirus pandemic.
The survey asked how people's lives and feelings may have changed during 2020 compared to the previous few years.
The causes of negative feelings included weakened economies, health worries of the respondent or a relative as well as job losses and difficulty finding employment.
Meanwhile, respondents said positive feelings during the pandemic year had been prompted by volunteering, exercise, caring for a pet or a feeling of general gratitude.
While organised by the UN, World Happiness Report was compiled ""by a group of independent experts acting in their personal capacities. Any views expressed in [the] report do not necessarily reflect the views of any organization, agency or program of the United Nations,"" the report's website states."
