id,title,link,date,text
https://yle.fi/uutiset/11871909,Finland awaits EMA position as official links AstraZeneca vaccine to blood clots,https://yle.fi/uutiset/osasto/news/finland_awaits_ema_position_as_official_links_astrazeneca_vaccine_to_blood_clots/11871909?origin=rss,"Tue, 06 Apr 2021 17:39:18 +0300","Finnish health authorities have confirmed that they are planning to continue use of the AstraZeneca coronavirus vaccine for the time being, after a senior official at the European Medicines Agency (EMA) linked the vaccine to blood clots.
Marco Cavaleri, head of vaccines strategy at the EMA, told Italy's Il Messaggero newspaper that he believes there is a ""clear"" link between the vaccine and rare cases of blood clots reported in people who recently received the jab.
""In my opinion, we can say it now, it is clear there is a link with the vaccine. But we still do not know what causes this reaction,"" he said.
Cavaleri's opinion is therefore not the official position of the EMA, but he added that the agency will be investigating the connection further and an announcement will be made in the coming days.
If the link to blood clotting can be confirmed, it would still be considered an extremely rare side effect. In Britain, about 30 of the 18 million people vaccinated with AstraZeneca by the end of March are known to have developed blood clot symptoms, and seven of them died, according to a report by the BBC (external link).
Finland awaits official EMA position 
Maija Kaukonen, a Senior Medical Officer with the Finnish Medicines Agency Fimea, told Yle that she was surprised by Cavaleri's statement.
""Now that Marco Cavaleri has come out with this in this way, I hope that the [EMA's] risk assessment committee will give its recommendation and views on the matter today [Tuesday]. However, such big decisions are usually not made on the first day,"" Kaukonen said.
The EMA's Pharmacovigilance Risk Assessment Committee (PRAC) began a three-day meeting on Tuesday to discuss a possible update to the recommendation on the use of the AstraZeneca vaccine.
Cavaleri's statement will have no immediate effect on how Finland distributes the AstraZeneca vaccine, according to Hanna Nohynek, head of the vaccine unit at the Finnish Institute for Health and Welfare THL. Finnish authorities will instead wait for an official statement from the EMA before assessing whether the current practice needs to be changed, Nohynek added.
""For the time being, Finland will follow the precautionary recommendation that the use of AstraZeneca be restricted to people aged 65 and over, because no such rare side effects have been observed in that age group,"" Nohynek said.
A number of countries have imposed restrictions on the use of the AstraZeneca vaccine, especially in younger adults."
https://yle.fi/uutiset/11871917,Chancellor of Justice responds to criticism of failed lockdown legislation,https://yle.fi/uutiset/osasto/news/chancellor_of_justice_responds_to_criticism_of_failed_lockdown_legislation/11871917?origin=rss,"Tue, 06 Apr 2021 17:28:34 +0300","Chancellor of Justice Tuomas Pöysti has responded to criticism of how a proposed bill advanced so far through the legislative process before being rejected by the Parliamentary Constitutional Law Committee last week.
The draft bill proposed introducing restrictions on people's movements in areas of the country worst-affected by the coronavirus epidemic.
Speaking at a press conference on Tuesday afternoon, Pöysti said that he did not feel he should have prevented the government from submitting the proposal to Parliament, despite being criticised for his supervision of the proposed bill.
He justified this on the grounds that the government must have the opportunity to make new proposals to Parliament which contain interpretations of the constitution.
Opinions on legislation not unanimous
Pöysti further pointed out that elements of the constitution are often in need of interpretation, and expert opinions on the proposed restrictions on movement were not unanimous.
""There were several statements for and against the proposal, which contributed to the possibilities for interpretation,"" he said.
His office also published a detailed article on the Chancellor of Justice's website (external link in Finnish) explaining the background to the process.
""The government did not act unlawfully, even if the constitutionality of the government's proposal is open to interpretation in the light of previous practice, as well as the Constitutional Law Committee deciding on a different position from the government in its assessment,"" Pöysti wrote.
However, according to critics, allowing the bill to make its way to parliament showed a lack of adequate supervision by the Chancellor of Justice, whose responsibility is to monitor the actions of the government.
Evaluation of old practices 
Pöysti had participated in government negotiations regarding the proposed legislation.
""These long-term practices give the impression that the Chancellor of Justice is a member of the government team, which leads to concerns about whether there will be blindness to what is taking place there,"" Pöysti said at Tuesday afternoon's press conference.
The preparation of the restrictions on movement was made particularly difficult by the perceived urgency, with Pöysti further pointing out that the proposed bill was prepared remarkably fast, even taking the exceptional circumstances into consideration.
Furthermore, the drafting process did not include a consultation round, as is usually the case, which Pöysti said can have a negative impact on the quality of a proposal."
https://yle.fi/uutiset/11871616,"FMI: Covid restrictions impact traffic volumes, improve air quality",https://yle.fi/uutiset/osasto/news/fmi_covid_restrictions_impact_traffic_volumes_improve_air_quality/11871616?origin=rss,"Tue, 06 Apr 2021 17:01:39 +0300","Between street dust and pollen, springtime in Finland can often mean a rapid deterioration in air quality.
The country is at the height of the spread of seasonal street dust, but current coronavirus restrictions may be providing some relief from this annual predicament, according to Pia Anttila, a researcher at the Finnish Meteorological Institute (FMI).
""Our experience, after one year of the pandemic, is that as traffic volumes have decreased, so have emissions, and air quality has improved. If the Covid-19 situation takes a turn for the worse, an improvement in air quality can be expected again,"" Anttila says.
Air pollution dropped dramatically in spring 2020
Traffic has a significant impact on urban air quality. Cars spread street dust from the surface of the road as well as release nitrogen dioxide into the air. A year ago, the coronavirus pandemic gave rise to urgent restrictions and many people started working from home in an effort to reduce social contacts.
This swift change in behavioural patterns was seen in pollution statistics, with car-related nitrogen dioxide emissions dropping drastically.
The amount of nitrogen dioxide in the air is indicative of how much people drive. Therefore, emissions can also be considered an indication of the efficacy of restrictions. Authorities recently used nitrogen dioxide values as a measure of human mobility, the same way mobile phone location data has been used previously.
The biggest change in pollution, in relation to last year, was in the Helsinki metropolitan area where the Uusimaa border closure cordoned off the area from the rest of the country for three weeks. Air pollution could decrease again this spring if new coronavirus measures restrict movement after the Easter holidays.
According to Anttila, the levels of nitric oxide started to increase again in the summer but have now stabilised at about 20 percent lower than normal.
Long-term environmental benefits?
Could the pandemic have long-term benefits for air quality? Possibly, if working from home becomes the new normal, Anttila says. The nitric oxide levels will however return to normal as soon as we resume regular traffic patterns.
In China, air pollution rose above pre-coronavirus levels in the summer as industry revved back up. Researchers estimate that the same can happen in Europe.
In Finland, the amount of nitrogen dioxide in urban air has been declining for years, in part because of more fuel-efficient cars.
At the same time, awareness of the health effects of air pollution has increased.
Will face masks remain a staple after the pandemic?
The widespread use of masks, such as the FFP2 mask, which protects against particles like street dust, could also bring relief to those suffering from pollen allergies, Anttila adds.
During the pandemic, the use of masks has become more widespread, and they may continue to be beneficial for high-risk groups by bringing much-needed relief during the street dust season.
Anttila says that although air quality routinely deteriorates in spring, Finland still remains a top contender for the cleanest air in Europe.
The FMI monitors air pollution in real time on its website, in order to inform citizens about air pollution exceeding threshold values."
https://yle.fi/uutiset/11872064,Left Alliance MP quits municipal role over alcohol use during council meeting,https://yle.fi/uutiset/osasto/news/left_alliance_mp_quits_municipal_role_over_alcohol_use_during_council_meeting/11872064?origin=rss,"Tue, 06 Apr 2021 18:46:17 +0300","Left Alliance MP Juho Kautto has announced his resignation as chair of Äänekoski City Council on Tuesday, following 'confusing' behaviour at a remotely-held council meeting last week.
Kautto's conduct had led to concern for his health, with tabloid Ilta-Sanomat reporting (external link in Finnish) that the deputy chair had to take over the meeting due to Kautto's erratic behaviour.
""Now that I have had some quiet time over Easter to think about this, I have come to the conclusion that the responsible thing to do is to resign from my position as chair. I will now focus on my role as a Member of Parliament,"" Kautto said in a press release.
The council meeting had to be adjourned due to Kautto's slurred speech and inability to perform his duties. He had consumed alcohol during the meeting and consequently became intoxicated.
""I am very sorry and I apologise for my actions. My conduct is wrong towards the other council members and the constituents. It is an embarrassing situation, but what is done is done,"" he said.
Kautto further stated that the incident made him realise that he needs help, and he has already sought assistance through occupational health.
""Some issues have built up while working remotely, and I medicated them with alcohol. Perhaps this unfortunate incident was needed for me to admit the severity of the situation,” Kautto wrote.
Chair of the Äänekoski Left Alliance's council group Matti Virtanen said he found Kautto's decision to resign surprising, but understandable.
""I understand that he wants to take responsibility for his actions. I did not expect this, but this is life. We are faced with a new situation and we need to move on. I hope Juho recovers. He retains the confidence of our group and myself. We want to be supportive,"" Virtanen said, adding that the party's council group intends to discuss the case in the upcoming days.
Kautto added that the Left Alliance party had given him their full support, but he does not wish to comment further on the matter at this stage."
https://yle.fi/uutiset/11872409,"Wednesday's papers: Helsinki's corona bus, mystery virus variant, climate action",https://yle.fi/uutiset/osasto/news/wednesdays_papers_helsinkis_corona_bus_mystery_virus_variant_climate_action/11872409?origin=rss,"Wed, 07 Apr 2021 08:59:22 +0300","Helsinki residents will soon have greater access to rapid coronavirus testing, reports Swedish-language Huvfudstadsbladet (HBL).
Authorities at Helsinki and Uusimaa healthcare district HUS are due to roll out a so-called ""Corona bus"" that will act as a mobile testing station for city residents.
""The procurement is now complete and the bus will be ready for use in the next two weeks, perhaps even as soon as next week,"" HUS' Director of Diagnostic Services Lasse Lehtonen told HBL.
The idea of the bus is to push up testing numbers at locations like construction sites and among immigrant communities which have seen disproportionately high case numbers, HBL writes.
The bus will provide antigen tests free of charge. Any positive cases will be tested again with a more reliable PCR test to confirm the result.
""The bus will largely be driven to schools or workplaces where it is possible to test large groups. Alternatively, it could be driven to a place with lots of people, where passersby can go in and get tested,"" Lehtonen told the paper.
Kemijärvi variant still a mystery
Tabloid Iltalehti reports on a coronavirus variant detected in the Lapland municipality of Kemijärvi in late March.
Genetic sequence of the virus, found in samples taken from three people, showed that it was not one of the British, Brazilian or South African variants blamed for the recent upsurge in infections across Europe.
Iltalehti quotes Lapland Hospital District's Markku Broas, who says more information on the variant should be available this week.
""[Private lab] Vita Laboratories reported that the sequencing of the entire genome has gone to the Institute of Biotechnology at the University of Helsinki and there have been certain delays. They said on Thursday that the results should come this week,"" Broas told the paper.
The infection cluster the variant came from now numbers nine cases, with the origin of the infection still unclear, Iltalehti writes.
Vanhanen chairs climate action meeting
Global finance ministers stated their commitment to fighting climate change at a virtual meeting on Tuesday, according to a story in Wednesday's Helsingin Sanomat.
Finance Minister Matti Vanhanen (Cen), who chaired the meeting, told the paper he believes that the world's financial elite now have a strong commitment to taking action on the environment.
""Every speech reflected a real awakening and commitment to action to combat and prevent climate change. That was the main message of the meeting,"" he said.
""The wheel is turning in the right direction,"" Vanhanen added.
The meeting of the group, dubbed the Coalition of Finance Ministers for Climate Action, involved the finance ministers of over 60 countries, including first-time attendees Japan, South Korea and the United States, HS writes.
Finland and Indonesia co-chair the group, which commits its members to a set of ideas known as the Helsinki Principles."
https://yle.fi/uutiset/11872590,"Better language training for vocational students needed, says education agency",https://yle.fi/uutiset/osasto/news/better_language_training_for_vocational_students_needed_says_education_agency/11872590?origin=rss,"Wed, 07 Apr 2021 11:01:16 +0300","The phone of Mufid ""Muffe"" Azad, who runs a busy construction and renovation company in Western Uusimaa, rings almost non-stop, with roughly every other call in either Finnish or Swedish.
""It seems that people are now putting the money saved on travel into renovations,"" Azad tells Yle.
However, despite the fact that business is currently ""booming"", Azad says that he does not have any employees with an immigrant background. A number of Kurdish-speaking jobseekers – a language Azad also speaks – have applied, but unfortunately he has not been able to hire them due to their lack of Finnish or Swedish language skills.
""They have all had good work qualifications, especially masonry skills. It has annoyed me a lot when I have not been able to hire them. I can speak to them in Kurdish, but I can't be on the site interpreting for them,"" he says.
Story continues after the photo.
Mufid ""Muffe"" Azad designed his company's logo.Paula Tiainen / Yle
Agency report identifies problems
The Finnish Education Evaluation Centre (FINEEC), an independent government agency that oversees the quality of education in Finland, identified problems in the vocational training of immigrants in a report (external link) entitled 'Immigrants’ educational pathways', which was published late last year.
The report found that while students with weaker language skills are accepted into vocational education, for some, the language skills they develop during their studies are not good enough for working life.
Categorised language proficiency requirements were abandoned in 2018, when the vocational education sector was reformed, but educational institutions still carry the responsibility of ensuring students starting studies have adequate language proficiency.
This does not seem to have happened across the board, the report found.
Story continues after the photo.
Researchers at the University of Jyväskylä say it's a ""myth"" that Finnish is uniquely difficult to learn. Jyrki Lyytikkä / Yle
""Poor language skills make it difficult to progress in and complete studies,"" FINEEC's assessment specialist Raisa Hievanen tells Yle. ""In addition, there should be a place to help young people to develop their language skills if they are not at a sufficient level to complete their vocational studies.""
FINEEC therefore recommends that the Ministry of Education and Culture monitor the performance of immigrants in vocational education, especially in light of the relaxing of language skills requirements. Up to 10,000 young people drop out of vocational studies every year, with language skills often a contributing factor.
""Students who do not achieve strong basic knowledge and skills during the training will be in a vulnerable position in the …. world of work. Immigrants must also have the opportunity to engage in continuous learning and to progress in their career,"" the report stated.
Training for teachers also needed
In addition, some teachers in vocational schools feel that their skills are not sufficient to teach pupils with an immigrant background.
For example, 66 different mother tongues were spoken among students in the field of logistics between 2018 and 2020. In the social and health sector, the corresponding figure was 96.
FINEEC further recommends in-service training for teachers in so-called 'language-aware teaching' to tackle this problem.
Azad's parents came to Finland as refugees when he was less than a year old. He has grown up in a Swedish-speaking environment and studied in a Finnish-language primary school.
""Maybe that lack of language skills doesn't hurt in a big factory, but I couldn't imagine putting an employee on site who doesn't have a common language with a renovation customer. The Finnish language is certainly not the easiest to learn,"" he adds.
A total of 73 Vocational Education Training (VET) providers and 711 VET teachers responded to the FINEEC survey."
https://yle.fi/uutiset/11872845,Finland's most popular baby names in 2020: Aino and Leo,https://yle.fi/uutiset/osasto/news/finlands_most_popular_baby_names_in_2020_aino_and_leo/11872845?origin=rss,"Wed, 07 Apr 2021 12:50:06 +0300","Aino and Leo were the most popular first names for children born in Finland last year, according to figures published by the Finnish Digital and Population Data Services Agency.
The agency found that Aino was given as a first name to 276 girls while Leo was the first name given to 356 boys.
The next most popular first names for girls after Aino were Olivia, Sofia, Pihla and Aada. The next most popular among boys were Eino, Oliver, Elias and Onni.
The popularity of certain names in 2020 appears to continue the recent trend among parents in Finland of choosing names that work in different languages and cultures.
Among Finland's Swedish-speaking population, Ellen was the most popular name for a girl while Emil was the top choice among parents of boys.
The data is based on names given to 47,839 children born in Finland last year that had been named by 5 April 2021. In total, 48,186 children were born in 2020 but some may have not received or officially registered a name by that date. Traditionally, Finnish first names tend to be kept secret until a child is baptised.
Some 23,356 girls and 24,483 boys were named, with 38,943 of them in Finnish and 3,246 in Swedish."
